    Número,Serviço,Quando ligar(resumido),Quando ligar(Completo)
193,Corpo de bombeiros/SIATE,"Acidentes (domésticos, de trânsito, etc) e incêndios","Incêndios, afogamentos,  necessidade de resgates, acidentes com animais, elétricos, domésticos, de trânsito"
190,Polícia militar,"Emergências policiais, situações de perigo",Quando se está em perigo imediato ou está acontecendo um crime
192,SAMU,"Atendimentos clínicos de emergência (infartos, derrames, febres repentinas. etc)","Acidentes com vítimas, suspeita de infarto ou AVC, queimaduras graves, trabalhos de parto de risco e outras situaçes de urgência (risco em um futuro próximo à vida da vítima) ou emergência (risco imediato) clínicas"
180,Central de Atendimento à mulher no Brasil,Denúncias de violência contra mulheres e informações sobre direitos das mulheres,"Para denunciar casos de violência contra a mulher (vítimas ou testemunhas) e para se informar sobre os direitos da mulher, inclusive com orientações sobre locais de atendimento"
100,Direitos humanos,Denúncias e proteção contra violações de direitos humanos,"Denúncias de violações, com foco para crianças e adolescentes, população LGBT, em situação de rua, idosa, com deficiência ou pertencente à minorias raciais.  Serve principalmente para tentar retirar as pessoas das situações onde sofrem abusos."
156,Central de Atendimento da Prefeitura,Dúvidas sobre serviços prestados pela prefeitura e rotas de ônibus,"Informações sobre serviços prestados pela prefeitura (endereços, hora de funcionamento, etc.) e informações sobre como chegar em diferentes lugais através do transporte público"
181,Denúncias anônimas,"Denúncias anônimas de crimes que já ocorreram, especialmente relacionadas ao narcotráfico","Quando um crime ocorre já ocorreu e se deseja denunciá-lo, com anonimato total e possibilidade de acompanhar as investigações depois"
